{
  "omst_type": "settlement-request",
  "request_id": "request-tokenized-bond-dvp-eur-50m",
  "settlement_intent": "examples/tokenized-bond-dvp/settlement-intent.json",
  "required_money": "EUR",
  "required_capabilities": ["DVP", "ATOMIC_SETTLEMENT"],
  "amount": "50000000",
  "deadline": "2026-09-02T00:00:00Z",
  "evidence_policy": {
    "effective_liquidity_max_age_seconds": 60
  },
  "x-note": "Synthetic settlement request."
}
